{
  "version": "rava-attestation-v0",
  "id": "att_4408f5741dd442cf0ac85f1083708687",
  "nonce": "55555555-5555-4555-8555-555555555555",
  "action_id": "act_4895d1ad8dd04025cb89a68c3f530621",
  "evaluator": "rava:service:6e7a1cdd29b0b78fd13af4c5598feff4",
  "outcome": "accepted",
  "subject": "travel.booking",
  "occurred_at": [
    2022,
    105,
    5,
    20,
    30,
    0,
    0,
    0,
    0
  ],
  "evidence_hash": "sha256:3333333333333333333333333333333333333333333333333333333333333333",
  "proof": {
    "signature_hex": "69fac21499eb30cbb873347a006f7482bfacc4ba05f0645eaa4b4f8f9e6247989f9107b8a19578650a77017f345bf17200233e951bdaea8649bb0d5411830a09"
  }
}